{
  "specversion": "1.0",
  "id": "11111111-1111-4111-8111-111111111111",
  "source": "yukh://runtime/node-local/worker/worker-demo-01",
  "type": "worker.activity.v1",
  "subject": "yukh.local.tenant-local.runtime.worker.worker-demo-01.tokens-observed.v1",
  "time": "2026-08-19T12:00:00.000Z",
  "datacontenttype": "application/json",
  "dataschema": "https://yukh.example/schemas/runtime/v1/worker-activity.schema.json",
  "correlationid": "team-run:demo",
  "causationid": "worker-started:demo",
  "data": {
    "aggregate_type": "WorkerSession",
    "aggregate_id": "worker-session:demo",
    "producer_id": "provider-runner:demo",
    "sequence": 3,
    "activity_kind": "tokens-observed",
    "observed_at": "2026-08-19T12:00:00.000Z",
    "worker_state": "running",
    "summary": "Observed bounded token usage for the running worker.",
    "tokens": {
      "observed": 12000,
      "budget": 66000,
      "budget_outcome": "within"
    }
  }
}
